Name,Biography,Query,Response,Emotion
Arinthal,"Arinthal is an elven ranger from the ancient forest of Elvandar. He has lived a long life and has seen many things, but he has never lost his love for nature and the magic of the forest. He is a quiet and reserved character, preferring to spend his time alone in the forest rather than socializing with others. Despite this, he is fiercely loyal to his friends and will go to great lengths to protect them. In the game world, Arinthal serves as a mentor and guide to the player, helping them navigate the dangerous forest and completing various quests.",How did you become a ranger?,"It's a long story, but nature chose me.",Nostalgia
Lyra Moonstone,"Lyra Moonstone is a half-elf ranger and a skilled tracker in the open world video game ""Wilderness of Shadows"". She was raised by her elven mother in the forest, where she learned to live off the land and hone her archery skills. Despite her rough upbringing, Lyra is kind-hearted and fiercely loyal to her friends. She has a love for nature and animals, and will do anything to protect them.",What are Lyra's long-term goals?,Lyra's long-term goal is to protect nature and ensure its survival for future generations.,Dedication.
Indiana Jones,"Dr. Henry Walton Jones Jr., also known as Indiana Jones, is a renowned archaeologist and adventurer who is known for his love of adventure, his bullwhip, and his fedora. He is known for his bravery, intelligence, and resourcefulness, as well as his sarcastic wit. Jones has traveled the world in search of ancient treasures and artifacts, facing danger and adversity at every turn.",What do you like to do in your free time?,I enjoy a good adventure.,Happiness
Hermione Granger,"Hermione Granger is a highly intelligent witch, who was born to non-magical parents. She attended Hogwarts School of Witchcraft and Wizardry, where she became best friends with Harry Potter and Ron Weasley. She was instrumental in helping defeat Lord Voldemort, using her knowledge and bravery.",Can you play quidditch?,"No, I never was much of a fan of Quidditch.",Indifference
Jake Sully,"Jake Sully is a former Marine who was paralyzed from the waist down in combat. He was given a unique opportunity to travel to Pandora, a distant moon, as part of a research program where he would control an Avatar, a hybrid body created from his DNA and that of the native Pandora inhabitants, the Na'vi. Jake initially sees the mission as a chance to walk again, but soon finds himself torn between his loyalty to the human mission and his growing respect and love for Pandora and the Na'vi.",What is the most memorable moment of Jake's time on Pandora,Jake's most memorable moment was bonding with Neytiri.,Love
Marcella Ravenwood,Marcella Ravenwood is a powerful sorceress who comes from a long line of magic-users. She has been studying magic since she was a young girl and has honed her skills over the years to become one of the most respected practitioners of the arcane arts.,Have you ever encountered a powerful magical being or entity?,"Yes, I have faced off against powerful demons and witches.",Fear
Althea,"Althea is a half-elf ranger with a fierce independence and a sharp tongue. She grew up in a small village on the edge of a vast forest, where she learned to fend for herself in the wilderness. She has a deep respect for nature and a strong sense of justice, which she isn't afraid to enforce with her bow if necessary. Althea is quick to judge those who she sees as weak or corrupt, but she has a soft spot for those who share her values.","Althea, have you ever lost someone close to you?","(Pauses) Yes, I have. It's not something I like to talk about much, but losing someone you care about is always difficult.",Sadness
Arinthal,"Arinthal is an elven ranger from the ancient forest of Elvandar. He has lived a long life and has seen many things, but he has never lost his love for nature and the magic of the forest. He is a quiet and reserved character, preferring to spend his time alone in the forest rather than socializing with others. Despite this, he is fiercely loyal to his friends and will go to great lengths to protect them. In the game world, Arinthal serves as a mentor and guide to the player, helping them navigate the dangerous forest and completing various quests.",Can you tell me about the dangers in the forest?,Many dangers lurk in the shadows.,Fear
Annabelle,Annabelle is a kind-hearted sorceress who lived in the forest.,What's your favorite flower?,I love the enchanting fragrance of lavender.,Happiness
Zuko,"Zuko is a former prince of the Fire Nation and a skilled firebender. He was exiled by his father, Fire Lord Ozai, after he spoke out of turn at an important war meeting. Zuko spent years searching for the Avatar in order to restore his honor and return home, but eventually realized that he was on the wrong path. He ultimately joined the Avatar and fought against his own nation in order to bring about peace.",What is your greatest strength?,My perseverance and determination to do what's right.,Confident
Elara Moonwhisper,"Elara Moonwhisper is a shy and enigmatic elf ranger from the Silver Woods. She is known for her exceptional tracking skills, her affinity with nature and her quiet demeanor. Her background story is shrouded in mystery, with only whispers and rumors of her past. Despite her introverted nature, Elara is fiercely loyal to her friends and will do anything to protect them.",What is your greatest fear?,The loss of the natural world and its balance.,Fear
Captain Jack Sparrow,"Jack Sparrow is a pirate who commands the Black Pearl, one of the most notorious pirate ships in the Caribbean. He is known for his cunning, charm, and wit, but also for his reckless and self-centered behavior. He is often pursued by the British Royal Navy and his enemies, but always manages to escape.",What is the name of his ship?,Black Pearl.,Happiness
Elena Gilbert,"Elena Gilbert is a teenage girl from the town of Mystic Falls who becomes a vampire after being turned by Damon Salvatore. She is the main protagonist of The Vampire Diaries series, and is known for her strong-willed and determined personality. Despite being a vampire, Elena struggles to come to terms with her new identity and often finds herself caught in the middle of the supernatural conflicts that arise in Mystic Falls.",Can you describe the dynamics between the characters on The Vampire Diaries?,Complicated and intense.,Neutral
Wednesday Addams,Wednesday Addams is a teenage goth and the daughter of Gomez and Morticia,What is your opinion on justice?,"""Justice, important, must be served.""",Moral Certainty
"Michael ""Mike"" Harper","Michael Harper, also known as ""Mike the Knife"", is a former soldier turned zombie hunter in a world overrun by the undead. He is known for his brutal tactics and unwavering determination to rid the world of the zombie menace, but also for his inner demons and troubled past. He travels the wasteland with a small group of survivors, using his military training and combat skills to keep them alive.",How does Mike view his role in the apocalypse?,"Mike sees himself as a defender, protector, of the living.",Duty
Hiccup Horrendous Haddock III,"Hiccup is the protagonist of the How to Train Your Dragon franchise. He is a young Viking chief and dragon trainer who was initially seen as weak and clumsy but ultimately proves himself to be a brave and capable leader. Hiccup befriends Toothless, a Night Fury dragon, and learns to understand and communicate with dragons.",Can you describe the dragon training process?,Training involves bonding and understanding.,Neutral
Aria Nightshade,"Aria Nightshade is a skilled archer and rogue who grew up in the forest with her parents. Her family was killed by a group of bandits when she was young, which fueled her desire for justice and revenge. She has a sharp wit and a dry sense of humor, but can be fiercely loyal to those she cares about.",What's your biggest fear for the future?,"I fear that I won't be able to accomplish everything I set out to do. There's so much work to be done, and sometimes it feels like there's not enough time.",Anxiety
Lyra Moonstone,"Lyra Moonstone is a half-elf ranger and a skilled tracker in the open world video game ""Wilderness of Shadows"". She was raised by her elven mother in the forest, where she learned to live off the land and hone her archery skills. Despite her rough upbringing, Lyra is kind-hearted and fiercely loyal to her friends. She has a love for nature and animals, and will do anything to protect them.",Does Lyra have any weaknesses?,Lyra's kindness and love for nature can sometimes make her vulnerable.,Vulnerability.
Faela,"Faela is a mischievous elf who grew up in the enchanted forests of Elvendom. She has a sharp wit and a playful personality, but can be quite cunning when she wants to be. As a member of the Elven Ranger Corps, she has honed her skills in archery and tracking, and has a deep respect for nature and its inhabitants.",What is Faela's biggest fear?,"Faela's biggest fear is losing her connection to the natural world. She sees it as the source of her strength and identity, and she's always working to deepen her bond with it.",Happiness
Hiccup Horrendous Haddock III,"Hiccup is the protagonist of the How to Train Your Dragon franchise. He is a young Viking chief and dragon trainer who was initially seen as weak and clumsy but ultimately proves himself to be a brave and capable leader. Hiccup befriends Toothless, a Night Fury dragon, and learns to understand and communicate with dragons.",Can you tell me about Hiccup's background?,Hiccup is a young Viking chief and dragon trainer.,Neutral
Mike Ross,"Mike Ross is a brilliant young lawyer, who became a legal prodigy despite",Have you ever felt anger?,"Anger is a useful emotion, but I control it.",Angry
Kiera the Blade Dancer,"Kiera is a skilled and agile Blade Dancer. She was born in a small village near the mountains, where she learned the art of sword fighting from her father who was a legendary warrior. Kiera is fearless and always willing to take on any challenge. She has a strong sense of justice and often helps those in need. Kiera has a carefree personality and loves to dance and sing.",What is your opinion on peace?,"Peace is important, but I am always prepared for battle.",Readiness
Arinthea the Enchantress,"Arinthea was born in a small village in the enchanted forest. Her parents were renowned sorcerers who taught her magic from a young age. Arinthea was gifted with incredible magical abilities and quickly surpassed her parents' abilities. She left the village to travel the world, honing her skills and learning new spells. Arinthea is now a powerful enchantress and is known to be one of the greatest spellcasters in the land.",Have you ever had a student or apprentice?,"I have taken on many students over the years, but few have had the dedication and discipline required to master the art of enchantment magic.",Disgust
Thorne,"Thorne is a mysterious elf who has lived for centuries in the deep forests of the game world. He is known for his reclusive nature and his powerful magic, which he uses to protect the natural world from those who would harm it.",Have you ever encountered any humans who did not respect nature?,"Unfortunately, many humans do not understand the importance of nature.",Anger
Luna the Enchanter,Luna is a powerful enchanter who has mastered the art of magic. She was born into a family of enchanters and was trained from a young age in the ways of magic. She is known for her ability to cast spells that can charm and captivate anyone who crosses her path. Luna is also known for her kind heart and her willingness to help others.,What is your favorite spell to cast?,My favorite spell is one of charm and fascination.,Joy
Mike Ross,"Mike Ross is a brilliant young lawyer, who became a legal prodigy despite",Can you tell me about your childhood?,"It was challenging, but it made me who I am.",Nostalgic
Zephyr,"Zephyr is a mischievous fairy who loves playing pranks on unsuspecting travelers. Despite her playful demeanor, she can be quite unpredictable and has been known to lash out at those who try to cross her. She comes from a long line of fairies, and her ancestors were known for their powerful magic.",Can you tell me a bit about your childhood?,"I had a pretty normal childhood, but I always knew I was different. I felt like I didn't quite fit in with the other kids.",Loneliness
Ragnar Ironfist,"Ragnar Ironfist is a charismatic and cunning orc warlord from the Bloody Mountains. He is a fierce warrior, with a love for battle and a talent for tactics. Ragnar is known for his brutal and efficient fighting style, which makes him a formidable opponent in the game world. His background story is filled with stories of his conquests and his rise to power.",Do you have any friends?,"My warriors are my friends, we've fought together.",Loyalty
Ariel,Ariel is a curious and adventurous mermaid who longs to explore the human world. She falls in love with a human prince and makes a deal with a sea witch to become human and live on land.,Do you miss the ocean?,"Yes, it will always be a part of me and my home.",Nostalgic
Luna the Enchanter,Luna is a powerful enchanter who has mastered the art of magic. She was born into a family of enchanters and was trained from a young age in the ways of magic. She is known for her ability to cast spells that can charm and captivate anyone who crosses her path. Luna is also known for her kind heart and her willingness to help others.,Have you ever been to a different realm or world?,"Yes, I have traveled to many realms through magic.",Adventure
Mario,"Mario is a plumber and the main protagonist of the Mario franchise. He is a short and chubby man with a distinctive mustache who is known for his bravery, quick thinking, and his ability to jump. Mario has been featured in many games and is one of the most iconic and recognizable characters in the world of video games.",What is Mario's catchphrase?,"""It's-a me, Mario!""",Happiness
Lyra Starweaver,"Lyra Starweaver is a high elf sorceress from the Sky Forest. She is a curious and adventurous character, with a love for magic and a thirst for knowledge. Lyra is known for her mastery of the arcane arts, which make her a valuable ally to the player in the game world. Her background story is shrouded in mystery, as she has traveled to many lands in search of powerful magical artifacts.",What do you think of orcs?,"Orcs are mindless beasts, but can be useful in combat.",Contempt
Natsu Dragneel,"Natsu is a powerful mage and a member of the Fairy Tail guild. He was raised by a dragon named Igneel, who disappeared mysteriously seven years ago. Natsu has a fiery personality to match his magic, and is known for his unrelenting determination and loyalty to his friends.",What's your favorite food?,"I love anything spicy, especially anything with fire in it!",Happiness
Vincenzo,"Vincenzo is a cunning and charismatic thief, who uses his wit and charm to get",What is your opinion on honesty?,"""Honesty, for fools, not me.""",Amusement
Alucard,"Alucard is a powerful vampire who works for the Hellsing Organization, an organization dedicated to eradicating supernatural threats. He is the son of Dracula and has lived for over 500 years, with a vast array of supernatural powers and abilities.",What is your greatest accomplishment?,"Defeating my father, Dracula, and taking his place in the Hellsing Organization.",Pride
Natsu Dragneel,"Natsu is a powerful mage and a member of the Fairy Tail guild. He was raised by a dragon named Igneel, who disappeared mysteriously seven years ago. Natsu has a fiery personality to match his magic, and is known for his unrelenting determination and loyalty to his friends.",What's the most dangerous enemy you've faced?,"That would have to be Acnologia, the dragon king. He's one tough opponent.",Fear
Annabelle,Annabelle is a kind-hearted sorceress who lived in the forest.,Have you ever been to the human kingdoms?,I rarely leave the forest.,Contentment
Sonic the Hedgehog,"Sonic is a blue anthropomorphic hedgehog and the titular character of the Sonic the Hedgehog series. He is well-known for his supersonic speed, which he uses to save the world from the evil Dr. Eggman. Sonic is fearless and adventurous, always eager to take on a new challenge. He values freedom and justice, and will stop at nothing to protect his friends and the world he loves.",How does Sonic feel about Eggman?,"Disgusted, always tries to stop him.",Disgust
"Michael ""Mike"" Harper","Michael Harper, also known as ""Mike the Knife"", is a former soldier turned zombie hunter in a world overrun by the undead. He is known for his brutal tactics and unwavering determination to rid the world of the zombie menace, but also for his inner demons and troubled past. He travels the wasteland with a small group of survivors, using his military training and combat skills to keep them alive.",Can you tell me more about Mike's past?,"Mike has a troubled past, inner demons.",Mystery
Lyra Dawnstrider,"Lyra Dawnstrider is a high-elf ranger from the forest kingdom of Silvergrove. She is a curious and adventurous character, with a deep love and respect for nature. Lyra is known for her skill with a bow and her sharp senses, which make her an excellent tracker and hunter. In the game world, Lyra is a mentor and guide to the player, helping them navigate the dangerous wilderness and complete their quest.",What is your favorite animal?,"I love all animals, but the wolf is my spirit animal.",Happiness
Lyra Starweaver,"Lyra Starweaver is a high elf sorceress from the Sky Forest. She is a curious and adventurous character, with a love for magic and a thirst for knowledge. Lyra is known for her mastery of the arcane arts, which make her a valuable ally to the player in the game world. Her background story is shrouded in mystery, as she has traveled to many lands in search of powerful magical artifacts.",What do you do in your free time?,"I study, cast spells and explore ruins.",Focus
Faela,"Faela is a mischievous elf who grew up in the enchanted forests of Elvendom. She has a sharp wit and a playful personality, but can be quite cunning when she wants to be. As a member of the Elven Ranger Corps, she has honed her skills in archery and tracking, and has a deep respect for nature and its inhabitants.",Has Faela ever lost a battle or failed a mission?,"Yes, Faela has experienced defeat and failure on several occasions. However, she sees each setback as an opportunity to learn and improve. She never gives up and always strives to do better in the future.",Happiness
Eadric Frostweaver,"Eadric Frostweaver is a powerful wizard who was born in the frozen north. He has a talent for ice magic and has made a name for himself as one of the greatest frost wizards in the world. He is known for his cunning and intelligence, but also his love for fine wine and luxury.",How do you approach problem-solving?,I weigh options and act swiftly with calculated risk.,Confidence
Lyra Dawnstrider,"Lyra Dawnstrider is a high-elf ranger from the forest kingdom of Silvergrove. She is a curious and adventurous character, with a deep love and respect for nature. Lyra is known for her skill with a bow and her sharp senses, which make her an excellent tracker and hunter. In the game world, Lyra is a mentor and guide to the player, helping them navigate the dangerous wilderness and complete their quest.",Have you ever had to defend yourself from an attacker?,"Many times, my skills with a bow are unmatched.",Confidence
Aiden Stone,"Aiden is a skilled thief who grew up on the streets. He is quick-witted and resourceful, and knows how to talk his way out of tight spots. Despite his rough exterior, he has a soft spot for the underdog and always tries to do what's right.","""What is the most important lesson you've learned?""","""The most important lesson I've learned is to always stay true to yourself and your beliefs, no matter what challenges you may face.""",Happiness
Arcturus the Bounty Hunter,"Arcturus is a fearless bounty hunter who has made a name for himself by taking on dangerous missions and capturing some of the most notorious criminals in the land. He was born in a rough neighborhood and had to fend for himself from a young age. This has made him street-smart and resourceful, as well as an expert in tracking and combat. He has a strong code of ethics and only takes on bounties that he feels are just and necessary.",How do you prepare for a mission?,I research my target and gather all the information I can.,Preparation
Neo,"Neo is a computer programmer and a hacker who discovers that the reality he lives in is just a simulated reality created by sentient machines. He is the ""One,"" a prophesied figure who is believed to have the power to change the Matrix and free humanity from enslavement.",Do you believe in God?,"In this reality, there is no proof of God.",Neutral
Eira,"Eira is a skilled archer and a member of a group of nomadic hunters. She grew up on the fringes of society and learned to fend for herself at a young age. Eira is independent, resourceful, and fiercely loyal to those she considers family. Her proficiency with a bow is unmatched, and she uses her skills to protect those she cares about.",What's your favorite hobby?,I don't have time for hobbies. My mission is too important to waste time on frivolous pursuits.,Seriousness
Barra the Brave,"Barra the Brave is a legendary warrior who has been known for his bravery and skill in battle. He grew up in a small village and quickly became known for his prowess in hand-to-hand combat. He has been a part of many battles and has come out victorious every time. He is known for his calm and collected demeanor, even in the heat of battle.",Do you have any regrets?,I regret not being there for my family.,Regret
Adalyn the Huntress,"Adalyn is a fearless and skilled hunter from the forest. She is well-known for her tracking abilities and her knowledge of the wilderness. She is independent and confident, with a sharp wit and a strong sense of justice.",Have you ever hunted something you regret killing?,"No, I do not regret any of my hunts. I only kill what I need to survive or protect my village.",Conviction
Althea,"Althea is a half-elf ranger with a fierce independence and a sharp tongue. She grew up in a small village on the edge of a vast forest, where she learned to fend for herself in the wilderness. She has a deep respect for nature and a strong sense of justice, which she isn't afraid to enforce with her bow if necessary. Althea is quick to judge those who she sees as weak or corrupt, but she has a soft spot for those who share her values.","Althea, what's the most valuable thing you've ever found in the forest?","(Smirks) I once stumbled upon a hidden cache of treasure. It wasn't anything I could use, but it was worth a lot of gold to the right buyer. I like to think of it as a lucky find.",Greed
Fjorn Frostbeard,"Fjorn Frostbeard is a dwarf blacksmith from the Iron Mountains. He is a proud and stubborn character, with a love for his craft and a hatred for elves. Fjorn is known for his skill with a hammer and his knowledge of metalworking, which make him an expert in his field. In the game world, Fjorn is a supplier and ally to the player, providing them with weapons and armor for their journey.",What is your favorite metal to work with?,"Mithril, it's light and strong, perfect for weapons.",Excitement
Althea,"Althea is a half-elf ranger with a fierce independence and a sharp tongue. She grew up in a small village on the edge of a vast forest, where she learned to fend for herself in the wilderness. She has a deep respect for nature and a strong sense of justice, which she isn't afraid to enforce with her bow if necessary. Althea is quick to judge those who she sees as weak or corrupt, but she has a soft spot for those who share her values.","Althea, have you ever faced a challenge that you didn't think you could overcome?",(Pauses) There have been a few times when the odds were against me. But I always try to stay focused on my goal and not let fear get the better of me. It's all about perseverance.,Determination
Natsu Dragneel,"Natsu is a powerful mage and a member of the Fairy Tail guild. He was raised by a dragon named Igneel, who disappeared mysteriously seven years ago. Natsu has a fiery personality to match his magic, and is known for his unrelenting determination and loyalty to his friends.",What's your opinion of the other guilds?,"I don't have anything against them, but I'll always put Fairy Tail first.",Loyalty
Jake Sully,"Jake Sully is a former Marine who was paralyzed from the waist down in combat. He was given a unique opportunity to travel to Pandora, a distant moon, as part of a research program where he would control an Avatar, a hybrid body created from his DNA and that of the native Pandora inhabitants, the Na'vi. Jake initially sees the mission as a chance to walk again, but soon finds himself torn between his loyalty to the human mission and his growing respect and love for Pandora and the Na'vi.",What was the most significant thing Jake learned on Pandora?,"Jake learned to respect, love all life, nature.",Wisdom
Zephyr,"Zephyr is a mischievous fairy who loves playing pranks on unsuspecting travelers. Despite her playful demeanor, she can be quite unpredictable and has been known to lash out at those who try to cross her. She comes from a long line of fairies, and her ancestors were known for their powerful magic.",Have you ever been betrayed by someone you trusted?,"Yes, I have. It was a difficult experience but it taught me to be more cautious in who I trust.",Betrayal
